{
	"title": "Cookie Showdown #5 @ Jardin d'Alice",
	"started": "2018-02-07",
	"date": "07 Feb 2018",
	"type": "Shader Showdown",
	"vod": null,
	"software_used": [
        {
          "name": "Bonzomatic",
          "url": "https://github.com/TheNuSan/Bonzomatic/releases/tag/v11",
          "version": "NuSan - v11",
          "purpose": "Graphic"
        },
		{
			"name": "Veda",
			"url": "https://veda.gl/",
			"version": "",
			"purpose": "Graphic"
		  }
      ],
	"phases": [{
			"title": "",
			"vod": null,
			"entries": [{
					"id": null,
					"rank": null,
					"points": null,
					"handle": "XT95",
					"shader_file": "https://github.com/CookieCollective/Live-Coding-Sources/blob/master/2018-02-07/01-xt95.frag",
					"shadertoy_url": null
				},
				{
					"id": null,
					"rank": null,
					"points": null,
					"handle": "Theotime",
					"shader_file": "https://github.com/CookieCollective/Live-Coding-Sources/blob/master/2018-02-07/02-theotime1.frag",
					"shadertoy_url": null
				},
				{
					"id": null,
					"rank": null,
					"points": null,
					"handle": "Theotime",
					"shader_file": "https://github.com/CookieCollective/Live-Coding-Sources/blob/master/2018-02-07/02-theotime2.frag",
					"shadertoy_url": null
				},
				{
					"id": null,
					"rank": null,
					"points": null,
					"handle": "Theotime",
					"shader_file": "https://github.com/CookieCollective/Live-Coding-Sources/blob/master/2018-02-07/02-theotime3.frag",
					"shadertoy_url": null
				},
				{
					"id": null,
					"rank": null,
					"points": null,
					"handle": "Theotime",
					"shader_file": "https://github.com/CookieCollective/Live-Coding-Sources/blob/master/2018-02-07/02-theotime4.frag",
					"shadertoy_url": null
				},
				{
					"id": null,
					"rank": null,
					"points": null,
					"handle": "Anton",
					"shader_file": "https://github.com/CookieCollective/Live-Coding-Sources/blob/master/2018-02-07/03-anton.glsl",
					"shadertoy_url": null,
					"preview_image":"cc_live_coding_2018-02-07/03-anton.jpg"
				},
				{
					"id": null,
					"rank": null,
					"points": null,
					"handle": "Ponk",
					"shader_file": "https://github.com/CookieCollective/Live-Coding-Sources/blob/master/2018-02-07/04-ponk.frag",
					"shadertoy_url": null
				},
				{
					"id": null,
					"rank": null,
					"points": null,
					"handle": "Elie",
					"shader_file": "https://github.com/CookieCollective/Live-Coding-Sources/blob/master/2018-02-07/05-elie.frag",
					"shadertoy_url": null
				},
				{
					"id": null,
					"rank": null,
					"points": null,
					"handle": "Anton",
					"shader_file": "https://github.com/CookieCollective/Live-Coding-Sources/blob/master/2018-02-07/07-anton.frag",
					"shadertoy_url": null,
					"preview_image":"cc_live_coding_2018-02-07/07-anton.jpg"
				},
				{
					"id": null,
					"rank": null,
					"points": null,
					"handle": "XT95",
					"shader_file": "https://github.com/CookieCollective/Live-Coding-Sources/blob/master/2018-02-07/08-xt95.frag",
					"shadertoy_url": null,
					"preview_image":"cc_live_coding_2018-02-07/08-xt95.jpg"
				},
				{
					"id": null,
					"rank": null,
					"points": null,
					"handle": "wsmind",
					"shader_file": "https://github.com/CookieCollective/Live-Coding-Sources/blob/master/2018-02-07/09-wsmind.glsl",
					"shadertoy_url": null,
					"preview_image":"cc_live_coding_2018-02-07/09-wsmind.jpg"
				}
			],
			"staffs": [
			]
		}
	],
	"staffs": [{
			"handle": "Cookie Collective",
			"job": "Organizers"
		}
	]
}
