{
	"title": "Cookie Showdown #6 @ Nogozon",
	"started": "2018-03-07",
	"date": "07 Mar 2018",
	"type": "Shader Showdown",
	"vod": null,
	"software_used": [
		{
			"name": "Veda",
			"url": "https://veda.gl/",
			"version": "",
			"purpose": "Graphic"
		  }
      ],
	"phases": [{
			"title": "Round #1",
			"vod": null,
			"entries": [{
					"id": null,
					"rank": null,
					"points": null,
					"handle": "Anton",
					"shader_file": "https://github.com/CookieCollective/Live-Coding-Sources/blob/master/2018-03-07/01-anton.frag",
					"shadertoy_url": null
				},
				{
					"id": null,
					"rank": null,
					"points": null,
					"handle": "Lamogui",
					"shader_file": "https://github.com/CookieCollective/Live-Coding-Sources/blob/master/2018-03-07/01-lamogui.frag",
					"shadertoy_url": null
				}
			],
			"staffs": [
			]
		},
		{
			"title": "Round #2",
			"vod": null,
			"entries": [{
					"id": null,
					"rank": null,
					"points": null,
					"handle": "Eybor",
					"shader_file": "https://github.com/CookieCollective/Live-Coding-Sources/blob/master/2018-03-07/02-eybor.frag",
					"shadertoy_url": null
				},
				{
					"id": null,
					"rank": null,
					"points": null,
					"handle": "Flopine",
					"shader_file": "https://github.com/CookieCollective/Live-Coding-Sources/blob/master/2018-03-07/02-flopine.frag",
					"shadertoy_url": null
				}
			],
			"staffs": [
			]
		},
		{
			"title": "Round #3",
			"vod": null,
			"entries": [{
					"id": null,
					"rank": null,
					"points": null,
					"handle": "Elie",
					"shader_file": "https://github.com/CookieCollective/Live-Coding-Sources/blob/master/2018-03-07/03-elie.frag",
					"shadertoy_url": null
				},
				{
					"id": null,
					"rank": null,
					"points": null,
					"handle": "Nicoptere",
					"shader_file": "https://github.com/CookieCollective/Live-Coding-Sources/blob/master/2018-03-07/03-nicoptere.frag",
					"shadertoy_url": null
				}
			],
			"staffs": [
			]
		},
		{
			"title": "Round #4",
			"vod": null,
			"entries": [{
					"id": null,
					"rank": null,
					"points": null,
					"handle": "Anton",
					"shader_file": "https://github.com/CookieCollective/Live-Coding-Sources/blob/master/2018-03-07/04-anton.frag",
					"shadertoy_url": null
				},
				{
					"id": null,
					"rank": null,
					"points": null,
					"handle": "Leon",
					"shader_file": "https://github.com/CookieCollective/Live-Coding-Sources/blob/master/2018-03-07/04-leon.frag",
					"shadertoy_url": null
				}
			],
			"staffs": [
			]
		},
		{
			"title": "Round #5",
			"vod": null,
			"entries": [{
					"id": null,
					"rank": null,
					"points": null,
					"handle": "Flopine",
					"shader_file": "https://github.com/CookieCollective/Live-Coding-Sources/blob/master/2018-03-07/05-flopine.frag",
					"shadertoy_url": null
				},
				{
					"id": null,
					"rank": null,
					"points": null,
					"handle": "Mon Blaz",
					"shader_file": "https://github.com/CookieCollective/Live-Coding-Sources/blob/master/2018-03-07/05-monblaz.frag",
					"shadertoy_url": null
				}
			],
			"staffs": [
			]
		}
	],
	"staffs": [{
			"handle": "Cookie Collective",
			"job": "Organizers"
		}
	]
}
