{
  "title": "Solskogen",
  "started": "2020-07-11",
  "date": "11 Jul 2020",
  "type": "Shader Showdown",
  "vod": null,
  "software_used": null,
  "phases": [
    {
      "title": "Qualifier 1",
      "vod": "https://www.youtube.com/watch?v=g9saEPw5Fg",
      "entries": [
        {
          "id": null,
          "rank": 1,
          "points": null,
          "handle": "evvvvil",
          "shader_file": null,
          "shadertoy_url": null
        },
        {
          "id": null,
          "rank": 2,
          "points": null,
          "handle": "tapped",
          "shader_file": null,
          "shadertoy_url": null,
          "vod": null
        }
      ],
      "staffs": [
        {
          "handle": "phobium",
          "job": "Dj Set"
        },
        {
          "handle": "ferris",
          "job": "Commentators"
        },
        {
          "handle": "Christian",
          "job": "Commentators"
        }
      ]
    },
    {
      "title": "Qualifier 2",
      "vod": "https://www.youtube.com/watch?v=UWFVrHXz8UI",
      "entries": [
        {
          "id": null,
          "rank": 1,
          "points": null,
          "handle": "alkama",
          "shader_file": null,
          "shadertoy_url": null
        },
        {
          "id": null,
          "rank": 2,
          "points": null,
          "handle": "blueberry",
          "shader_file": null,
          "shadertoy_url": null,
          "vod": null
        }
      ],
      "staffs": [
        {
          "handle": "phobium",
          "job": "Dj Set"
        },
        {
          "handle": "ferris",
          "job": "Commentators"
        },
        {
          "handle": "Christian",
          "job": "Commentators"
        }
      ]
    },
    {
      "title": "Qualifier 3",
      "vod": "https://www.youtube.com/watch?v=5rjNcG7ioaU",
      "entries": [
        {
          "id": null,
          "rank": 1,
          "points": null,
          "handle": "blackle",
          "shader_file": null,
          "shadertoy_url": null
        },
        {
          "id": null,
          "rank": 2,
          "points": null,
          "handle": "wrighter",
          "shader_file": null,
          "shadertoy_url": null,
          "vod": null
        }
      ],
      "staffs": [
        {
          "handle": "phobium",
          "job": "Dj Set"
        },
        {
          "handle": "ferris",
          "job": "Commentators"
        },
        {
          "handle": "Christian",
          "job": "Commentators"
        }
      ]
    },
    {
      "title": "Qualifier 4",
      "vod": "https://www.youtube.com/watch?v=7NtxP62lAhE",
      "entries": [
        {
          "id": null,
          "rank": 1,
          "points": null,
          "handle": "provod",
          "shader_file": null,
          "shadertoy_url": null
        },
        {
          "id": null,
          "rank": 2,
          "points": null,
          "handle": "rohtie",
          "shader_file": null,
          "shadertoy_url": null,
          "vod": null
        }
      ],
      "staffs": [
        {
          "handle": "phobium",
          "job": "Dj Set"
        },
        {
          "handle": "ferris",
          "job": "Commentators"
        },
        {
          "handle": "Christian",
          "job": "Commentators"
        }
      ]
    },
    {
      "title": "Semifinal 1",
      "vod": "https://www.youtube.com/watch?v=gO1V2mCKqOk",
      "entries": [
        {
          "id": null,
          "rank": 1,
          "points": null,
          "handle": "evvvvil",
          "shader_file": null,
          "shadertoy_url": null
        },
        {
          "id": null,
          "rank": 2,
          "points": null,
          "handle": "alkama",
          "shader_file": null,
          "shadertoy_url": null,
          "vod": null
        }
      ],
      "staffs": [
        {
          "handle": "phobium",
          "job": "Dj Set"
        },
        {
          "handle": "ferris",
          "job": "Commentators"
        },
        {
          "handle": "Christian",
          "job": "Commentators"
        }
      ]
    },
    {
      "title": "Semifinal 2",
      "vod": "https://www.youtube.com/watch?v=LasL3OGKR_I",
      "entries": [
        {
          "id": null,
          "rank": 1,
          "points": null,
          "handle": "blackle",
          "shader_file": null,
          "shadertoy_url": null
        },
        {
          "id": null,
          "rank": 2,
          "points": null,
          "handle": "provod",
          "shader_file": null,
          "shadertoy_url": null,
          "vod": null
        }
      ],
      "staffs": [
        {
          "handle": "phobium",
          "job": "Dj Set"
        },
        {
          "handle": "ferris",
          "job": "Commentators"
        },
        {
          "handle": "Christian",
          "job": "Commentators"
        }
      ]
    },
    {
      "title": "Final",
      "vod": "https://www.youtube.com/watch?v=9Nk-cvlonwE",
      "entries": [
        {
          "id": null,
          "rank": 1,
          "points": null,
          "handle": "evvvvil",
          "shader_file": null,
          "shadertoy_url": null
        },
        {
          "id": null,
          "rank": 2,
          "points": null,
          "handle": "blackle",
          "shader_file": null,
          "shadertoy_url": null,
          "vod": null
        }
      ],
      "staffs": [
        {
          "handle": "phobium",
          "job": "Dj Set"
        },
        {
          "handle": "ferris",
          "job": "Commentators"
        },
        {
          "handle": "Christian",
          "job": "Commentators"
        }
      ]
    }
  ],
  "staffs": []
}
