{
	"title": "Laval Virtual 2018 / Cookie Showdown #7",
	"started": "2018-04-07",
	"date": "07 Apr 2018",
	"type": "Shader Showdown",
	"vod": "https://www.youtube.com/watch?v=6ul-jeLTQbM",
	"software_used": [
		{
			"name": "Veda",
			"url": "https://veda.gl/",
			"version": "",
			"purpose": "Graphic"
		  }
      ],
	"phases": [{
			"title": "Exquisite Shader",
			"vod": null,
			"entries": [{
					"id": null,
					"rank": null,
					"points": null,
					"handle": "Elie",
					"shader_file": "https://github.com/CookieCollective/Live-Coding-Sources/blob/master/2018-04-07/01-elie.frag",
					"shadertoy_url": null
				},
				{
					"id": null,
					"rank": null,
					"points": null,
					"handle": "Koltes",
					"shader_file": "https://github.com/CookieCollective/Live-Coding-Sources/blob/master/2018-04-07/02-koltes.frag",
					"shadertoy_url": null
				},
				{
					"id": null,
					"rank": null,
					"points": null,
					"handle": "Elie",
					"shader_file": "https://github.com/CookieCollective/Live-Coding-Sources/blob/master/2018-04-07/03-elie.frag",
					"shadertoy_url": null
				},
				{
					"id": null,
					"rank": null,
					"points": null,
					"handle": "Elie",
					"shader_file": "https://github.com/CookieCollective/Live-Coding-Sources/blob/master/2018-04-07/04-elie.frag",
					"shadertoy_url": null
				},
				{
					"id": null,
					"rank": null,
					"points": null,
					"handle": "Adrian",
					"shader_file": "https://github.com/CookieCollective/Live-Coding-Sources/blob/master/2018-04-07/05-adrian.frag",
					"shadertoy_url": null
				},
				{
					"id": null,
					"rank": null,
					"points": null,
					"handle": "Jean Michel",
					"shader_file": "https://github.com/CookieCollective/Live-Coding-Sources/blob/master/2018-04-07/06-jeanmichel.frag",
					"shadertoy_url": null
				},
				{
					"id": null,
					"rank": null,
					"point": null,
					"handle": "Koltes",
					"shader_file": "https://github.com/CookieCollective/Live-Coding-Sources/blob/master/2018-04-07/07-koltes.frag",
					"shadertoy_url": null
				}
			],
			"staffs": [
			]
		}
	],
	"staffs": [{
			"handle": "Cookie Collective",
			"job": "Organizers"
		}
	]
}
