{
	"title": "Woot Devices 4",
	"started": "2019-05-04",
	"date": "4 May 2019",
	"type": "Shader Showdown",
	"vod": null,
	"software_used": [
        {
			"name": "Veda",
			"url": "https://veda.gl/",
			"version": "",
			"purpose": "Graphic"
		}
      ],
	"phases": [{
			"title": "",
			"vod": null,
			"entries": [{
					"id": null,
					"rank": null,
					"points": null,
					"handle": "Elie",
					"shader_file": "https://github.com/CookieCollective/Live-Coding-Sources/blob/master/2019-05-04/elie1.frag",
					"shadertoy_url": null
				},
				{
					"id": null,
					"rank": null,
					"points": null,
					"handle": "Elie",
					"shader_file": "https://github.com/CookieCollective/Live-Coding-Sources/blob/master/2019-05-04/elie2.frag",
					"shadertoy_url": null
				},
				{
					"id": null,
					"rank": null,
					"points": null,
					"handle": "Elie",
					"shader_file": "https://github.com/CookieCollective/Live-Coding-Sources/blob/master/2019-05-04/elie3.frag",
					"shadertoy_url": null
				},
				{
					"id": null,
					"rank": null,
					"points": null,
					"handle": "Elie",
					"shader_file": "https://github.com/CookieCollective/Live-Coding-Sources/blob/master/2019-05-04/elie4.frag",
					"shadertoy_url": null
				},
				{
					"id": null,
					"rank": null,
					"points": null,
					"handle": "Elie",
					"shader_file": "https://github.com/CookieCollective/Live-Coding-Sources/blob/master/2019-05-04/elie5.frag",
					"shadertoy_url": null
				}
			],
			"staffs": [
			]
		}
	],
	"staffs": [{
			"handle": "Cookie Collective",
			"job": "Organizers"
		}
	]
}
