{
	"title": "Cookie Demoparty / Showdown #4 @ Jardin d'Alice",
	"started": "2017-12-08",
	"date": "8 December 2017",
	"type": "Shader Showdown",
	"vod": "https://youtu.be/ugs3-B3Tng0",
	"software_used": [
        {
          "name": "Bonzomatic",
          "url": "https://github.com/TheNuSan/Bonzomatic/releases/tag/v11",
          "version": "NuSan - v11",
          "purpose": "Graphic"
        }
      ],
	"phases": [{
			"title": "Quarter #1",
			"vod": null,
			"entries": [{
					"id": null,
					"rank": 1,
					"points": null,
					"handle": "Flopine",
					"shader_file": "https://github.com/CookieCollective/Live-Coding-Sources/blob/master/2017-12-08/01-flopine.glsl",
					"shadertoy_url": null,
                    "preview_image": "cc_live_coding_2017-12-08/01-flopine.jpg"
				},
				{
					"id": null,
					"rank": 2,
					"points": null,
					"handle": "Eybor",
					"shader_file": "https://github.com/CookieCollective/Live-Coding-Sources/blob/master/2017-12-08/01-eybor.glsl",
					"shadertoy_url": null,
                    "preview_image": "cc_live_coding_2017-12-08/01-eybor.jpg"
				}
			],
			"staffs": [
			]
		},
        {
			"title": "Quarter #2",
			"vod": null,
			"entries": [{
					"id": null,
					"rank": 1,
					"points": null,
					"handle": "Theotime",
					"shader_file": "https://github.com/CookieCollective/Live-Coding-Sources/blob/master/2017-12-08/02-theotime.glsl",
					"shadertoy_url": null,
                    "preview_image": "cc_live_coding_2017-12-08/02-theotime.jpg"
				},
				{
					"id": null,
					"rank": 2,
					"points": null,
					"handle": "Anton",
					"shader_file": "https://github.com/CookieCollective/Live-Coding-Sources/blob/master/2017-12-08/02-anton.glsl",
					"shadertoy_url": null,
                    "preview_image": "cc_live_coding_2017-12-08/02-anton.jpg"
				}
			],
			"staffs": [
			]
		},
        {
			"title": "Quarter #3",
			"vod": null,
			"entries": [{
					"id": null,
					"rank": 1,
					"points": null,
					"handle": "XT95",
					"shader_file": "https://github.com/CookieCollective/Live-Coding-Sources/blob/master/2017-12-08/03-xt95.glsl",
					"shadertoy_url": null,
                    "preview_image": "cc_live_coding_2017-12-08/03-xt95.jpg"
				},
				{
					"id": null,
					"rank": 2,
					"points": null,
					"handle": "Lamogui",
					"shader_file": "https://github.com/CookieCollective/Live-Coding-Sources/blob/master/2017-12-08/03-lamogui.glsl",
					"shadertoy_url": null,
                    "preview_image": "cc_live_coding_2017-12-08/03-lamogui.jpg"
				}
			],
			"staffs": [
			]
		},
        {
			"title": "Quarter #4",
			"vod": null,
			"entries": [{
					"id": null,
					"rank": 1,
					"points": null,
					"handle": "CoyHot",
					"shader_file": "https://github.com/CookieCollective/Live-Coding-Sources/blob/master/2017-12-08/04-coyhot.glsl",
					"shadertoy_url": null,
                    "preview_image": "cc_live_coding_2017-12-08/04-coyhot.jpg"
				},
				{
					"id": null,
					"rank": 2,
					"points": null,
					"handle": "Xtrium",
					"shader_file": "https://github.com/CookieCollective/Live-Coding-Sources/blob/master/2017-12-08/04-xtrium.glsl",
					"shadertoy_url": null,
                    "preview_image": "cc_live_coding_2017-12-08/04-xtrium.jpg"
				}
			],
			"staffs": [
			]
		},
        {
			"title": "Semi #1",
			"vod": null,
			"entries": [{
					"id": null,
					"rank": 1,
					"points": null,
					"handle": "Flopine",
					"shader_file": "https://github.com/CookieCollective/Live-Coding-Sources/blob/master/2017-12-08/05-flopine.glsl",
					"shadertoy_url": null,
                    "preview_image": "cc_live_coding_2017-12-08/05-flopine.jpg"
				},
				{
					"id": null,
					"rank": 2,
					"points": null,
					"handle": "Theotime",
					"shader_file": "https://github.com/CookieCollective/Live-Coding-Sources/blob/master/2017-12-08/05-theotime.glsl",
					"shadertoy_url": null,
                    "preview_image": "cc_live_coding_2017-12-08/05-theotime.jpg"
				}
			],
			"staffs": [
			]
		},
        {
			"title": "Semi #2",
			"vod": null,
			"entries": [{
					"id": null,
					"rank": 1,
					"points": null,
					"handle": "XT95",
					"shader_file": "https://github.com/CookieCollective/Live-Coding-Sources/blob/master/2017-12-08/06-xt95-xmen-edit.glsl",
					"shadertoy_url": null,
                    "preview_image": "cc_live_coding_2017-12-08/06-xt95-xmen-edit.jpg"
				},
				{
					"id": null,
					"rank": 2,
					"points": null,
					"handle": "CoyHot",
					"shader_file": "https://github.com/CookieCollective/Live-Coding-Sources/blob/master/2017-12-08/06-coyhot.glsl",
					"shadertoy_url": null,
                    "preview_image": "cc_live_coding_2017-12-08/06-coyhot.jpg"
				}
			],
			"staffs": [
			]
		},
        {
			"title": "Final",
			"vod": null,
			"entries": [{
					"id": null,
					"rank": 1,
					"points": null,
					"handle": "XT95",
					"shader_file": "https://github.com/CookieCollective/Live-Coding-Sources/blob/master/2017-12-08/07-xt95.glsl",
					"shadertoy_url": null,
                    "preview_image": "cc_live_coding_2017-12-08/07-xt95.jpg"
				},
				{
					"id": null,
					"rank": 2,
					"points": null,
					"handle": "Flopine",
					"shader_file": "https://github.com/CookieCollective/Live-Coding-Sources/blob/master/2017-12-08/07-flopine.glsl",
					"shadertoy_url": null,
                    "preview_image": "cc_live_coding_2017-12-08/07-flopine.jpg"
				}
			],
			"staffs": [
			]
		},
        {
			"title": "Extra",
			"vod": null,
			"entries": [{
					"id": null,
					"rank": null,
					"points": null,
					"handle": "Extra #1",
					"shader_file": "https://github.com/CookieCollective/Live-Coding-Sources/blob/master/2017-12-08/extra-01.glsl",
					"shadertoy_url": null,
                    "preview_image": "cc_live_coding_2017-12-08/extra-01.jpg"
				},
				{
					"id": null,
					"rank": null,
					"points": null,
					"handle": "Extra #2",
					"shader_file": "https://github.com/CookieCollective/Live-Coding-Sources/blob/master/2017-12-08/extra-02.glsl",
					"shadertoy_url": null,
                    "preview_image": "cc_live_coding_2017-12-08/extra-02.jpg"
				},
				{
					"id": null,
					"rank": null,
					"points": null,
					"handle": "Extra #3",
					"shader_file": "https://github.com/CookieCollective/Live-Coding-Sources/blob/master/2017-12-08/extra-03.dx9.hlsl",
					"shadertoy_url": null
				},
				{
					"id": null,
					"rank": null,
					"points": null,
					"handle": "Extra #4",
					"shader_file": "https://github.com/CookieCollective/Live-Coding-Sources/blob/master/2017-12-08/extra-04.glsl",
					"shadertoy_url": null,
                    "preview_image": "cc_live_coding_2017-12-08/extra-04.jpg"
				},
				{
					"id": null,
					"rank": null,
					"points": null,
					"handle": "Extra #5",
					"shader_file": "https://github.com/CookieCollective/Live-Coding-Sources/blob/master/2017-12-08/extra-05.glsl",
					"shadertoy_url": null,
                    "preview_image": "cc_live_coding_2017-12-08/extra-05.jpg"
				}
			],
			"staffs": [
			]
		}
	],
	"staffs": [{
			"handle": "Cookie Collective",
			"job": "Organizers"
		}
	]
}
