{
  "title": "Shader Chaλλenge 2021",
  "started": "2021-02-27",
  "date": "27 Feb 2021",
  "type": "Shader Challenge",
  "vod": "https://www.youtube.com/watch?v=2NJrpOFxSSo",
  "software_used": null,
  "phases": [
    {
      "title": null,
      "entries": [
        {
          "id": null,
          "rank": null,
          "points": null,
          "handle": "FMS_Cat",
          "shader_file": null,
          "shadertoy_url": "https://www.shadertoy.com/view/tlyBWw"
        },
        {
          "id": null,
          "rank": null,
          "points": null,
          "handle": "butadiene",
          "shader_file": null,
          "shadertoy_url": "https://www.shadertoy.com/view/wtGfWw"
        },
        {
          "id": null,
          "rank": null,
          "points": null,
          "handle": "sp4ghet",
          "shader_file": null,
          "shadertoy_url": null
        }
      ],
      "staffs": [
        {
          "handle": "らくとあいす (lactoice)",
          "job": "Live Music"
        },
        {
          "handle": "わたし (phi16)",
          "job": "Commentators"
        }
      ]
    }
  ],
  "staffs": [
    {
	"handle": "わたし (phi16)",
	"job": "Organizers"
    }
  ]
}
