{
  "title": "Very Important Party",
  "started": "2018-06-01",
  "date": "1 - 3 Jun 2018",
  "type": "Shader Showdown",
  "vod": null,
  "software_used": [{
		"name": "Bonzomatic",
		"url": "https://github.com/TheNuSan/Bonzomatic/releases/tag/v11",
		"version": "NuSan - v11",
		"purpose": "Graphic"
	  	}],
  "phases": [
    {
      "title": "Qualification #1",
      "entries": [
        {
          "id": null,
          "rank": 1,
          "points": null,
          "handle": "ponk",
          "shader_file": "https://github.com/CookieCollective/Live-Coding-Sources/blob/master/2018-06-02/01-ponk.glsl",
          "shadertoy_url": null,
          "preview_image": "vip_2018-06-02/01-ponk.jpg"
        },
        {
          "id": null,
          "rank": 2,
          "points": null,
          "handle": "xtrium",
          "shader_file": "https://github.com/CookieCollective/Live-Coding-Sources/blob/master/2018-06-02/01-xtrium.glsl",
          "shadertoy_url": null,
          "preview_image": "vip_2018-06-02/01-xtrium.jpg"
        }
      ],
      "staffs": [
      ]
    },
    {
      "title": "Qualification #2",
      "entries": [
        {
          "id": null,
          "rank": 1,
          "points": null,
          "handle": "CoyHot",
          "shader_file": "https://github.com/CookieCollective/Live-Coding-Sources/blob/master/2018-06-02/02-coyhot.glsl",
          "shadertoy_url": null,
          "preview_image": "vip_2018-06-02/02-coyhot.jpg"
        },
        {
          "id": null,
          "rank": 2,
          "points": null,
          "handle": "lamogui",
          "shader_file": "https://github.com/CookieCollective/Live-Coding-Sources/blob/master/2018-06-02/02-lamogui.glsl",
          "shadertoy_url": null,
          "preview_image": "vip_2018-06-02/02-lamogui.jpg"
        }
      ],
      "staffs": [
      ]
    },
    {
      "title": "Semi #1",
      "entries": [
        {
          "id": null,
          "rank": 1,
          "points": null,
          "handle": "ponk",
          "shader_file": "https://github.com/CookieCollective/Live-Coding-Sources/blob/master/2018-06-02/03-ponk.glsl",
          "shadertoy_url": null,
          "preview_image": "vip_2018-06-02/03-ponk.jpg"
        },
        {
          "id": null,
          "rank": 2,
          "points": null,
          "handle": "Flopine",
          "shader_file": "https://github.com/CookieCollective/Live-Coding-Sources/blob/master/2018-06-02/03-flopine.glsl",
          "shadertoy_url": null,
          "preview_image": "vip_2018-06-02/03-flopine.jpg"
        }
      ],
      "staffs": [
      ]
    },
    {
      "title": "Semi #2",
      "entries": [
        {
          "id": null,
          "rank": 1,
          "points": null,
          "handle": "lsdlive",
          "shader_file": "https://github.com/CookieCollective/Live-Coding-Sources/blob/master/2018-06-02/04-lsdlive.glsl",
          "shadertoy_url": null,
          "preview_image": "vip_2018-06-02/04-lsdlive.jpg"
        },
        {
          "id": null,
          "rank": 2,
          "points": null,
          "handle": "CoyHot",
          "shader_file": "https://github.com/CookieCollective/Live-Coding-Sources/blob/master/2018-06-02/04-coyhot.glsl",
          "shadertoy_url": null,
          "preview_image": "vip_2018-06-02/04-coyhot.jpg"
        }
      ],
      "staffs": [
      ]
    },
    {
      "title": "Little Final",
      "entries": [
        {
          "id": null,
          "rank": null,
          "points": null,
          "handle": "CoyHot",
          "shader_file": "https://github.com/CookieCollective/Live-Coding-Sources/blob/master/2018-06-02/05-coyhot.glsl",
          "shadertoy_url": null,
          "preview_image": "vip_2018-06-02/05-coyhot.jpg"
        },
        {
          "id": null,
          "rank": null,
          "points": null,
          "handle": "ponk",
          "shader_file": "https://github.com/CookieCollective/Live-Coding-Sources/blob/master/2018-06-02/05-ponk.glsl",
          "shadertoy_url": null,
          "preview_image": "vip_2018-06-02/05-ponk.jpg"
        }
      ],
      "staffs": [
      ]
    },
    {
      "title": "Great Final",
      "entries": [
        {
          "id": null,
          "rank": 1,
          "points": null,
          "handle": "Flopine",
          "shader_file": "https://github.com/CookieCollective/Live-Coding-Sources/blob/master/2018-06-02/06_flopine.glsl",
          "shadertoy_url": null,
          "preview_image": "vip_2018-06-02/06_flopine.jpg"
        },
        {
          "id": null,
          "rank": 2,
          "points": null,
          "handle": "lsdlive",
          "shader_file": "https://github.com/CookieCollective/Live-Coding-Sources/blob/master/2018-06-02/06-lsdlive.glsl",
          "shadertoy_url": null,
          "preview_image": "vip_2018-06-02/06-lsdlive.jpg"
        }
      ],
      "staffs": [
      ]
    }
  ],
  "staffs": [{
    "handle": "Cookie Collective",
    "job": "Organizers"
  }
  ]
}
