{
  "title": "Outline Online 2021",
  "started": "2021-05-13",
  "date": "13 - 16 May 2021",
  "type": "Shader Showdown",
  "vod": null,
  "software_used": [
    {
      "name": "Bonzomatic",
      "url": "https://github.com/TheNuSan/Bonzomatic/releases/tag/v11",
      "version": "NuSan - v11",
      "purpose": "Graphic"
    }
  ],
  "phases": [
    {
      "title": "Group 1 - Match 1",
      "vod": null,
      "entries": [
        {
          "id": null,
          "rank": null,
          "points": null,
          "handle": "anticore",
          "shader_file": null,
          "shadertoy_url": "https://www.shadertoy.com/view/ssjSDV"
        },
        {
          "id": null,
          "rank": null,
          "points": null,
          "handle": "MrSoleil",
          "shader_file": null,
          "shadertoy_url": null
        }
      ],
      "staffs": [
      ]
    },
    {
      "title": "Group 2 - Match 1",
      "vod": null,
      "entries": [
        {
          "id": null,
          "rank": null,
          "points": null,
          "handle": "totetmatt",
          "shader_file": null,
          "shadertoy_url": null
        },
        {
          "id": null,
          "rank": null,
          "points": null,
          "handle": "blackle",
          "shader_file": null,
          "shadertoy_url": null
        }
      ],
      "staffs": [
      ]
    },
    {
      "title": "Group 1 - Match 2",
      "vod": null,
      "entries": [
        {
          "id": null,
          "rank": null,
          "points": null,
          "handle": "evvvvil",
          "shader_file": null,
          "shadertoy_url": null
        },
        {
          "id": null,
          "rank": null,
          "points": null,
          "handle": "MonsieurSoleil",
          "shader_file": null,
          "shadertoy_url": null
        }
      ],
      "staffs": [
      ]
    },
    {
      "title": "Group 2 - Match 2",
      "vod": null,
      "entries": [
        {
          "id": null,
          "rank": null,
          "points": null,
          "handle": "cosamentale",
          "shader_file": null,
          "shadertoy_url": "https://www.shadertoy.com/view/fs2XWc"
        },
        {
          "id": null,
          "rank": null,
          "points": null,
          "handle": "totetmatt",
          "shader_file": null,
          "shadertoy_url": null
        }
      ],
      "staffs": [
      ]
    },
    {
      "title": "Group 1 - Match 3",
      "vod": null,
      "entries": [
        {
          "id": null,
          "rank": null,
          "points": null,
          "handle": "evvvvil",
          "shader_file": null,
          "shadertoy_url": null
        },
        {
          "id": null,
          "rank": null,
          "points": null,
          "handle": "anticore",
          "shader_file": null,
          "shadertoy_url": null
        }
      ],
      "staffs": [
      ]
    },
    {
      "title": "Group 2 - Match 3",
      "vod": null,
      "entries": [
        {
          "id": null,
          "rank": null,
          "points": null,
          "handle": "blackle",
          "shader_file": null,
          "shadertoy_url": null
        },
        {
          "id": null,
          "rank": null,
          "points": null,
          "handle": "cosamentale",
          "shader_file": null,
          "shadertoy_url": "https://www.shadertoy.com/view/NsSXWd"
        }
      ],
      "staffs": [
      ]
    },
    {
      "title": "Final",
      "vod": null,
      "entries": [
        {
          "id": null,
          "rank": 1,
          "points": null,
          "handle": "evvvvil",
          "shader_file": null,
          "shadertoy_url": "https://www.shadertoy.com/view/sdBSDt"
        },
        {
          "id": null,
          "rank": 2,
          "points": null,
          "handle": "cosamentale",
          "shader_file": null,
          "shadertoy_url": null
        }
      ],
      "staffs": [
       
      ]
    },
    {
      "title": "Shaderjam 1",
      "entries": [
        {
          "id": null,
          "rank": null,
          "points": null,
          "handle": "exca",
          "shader_file": null,
          "shadertoy_url": null
        },
        {
          "id": null,
          "rank": null,
          "points": null,
          "handle": "lechugafeliz",
          "shader_file": null,
          "shadertoy_url": null
        },
        {
          "id": null,
          "rank": null,
          "points": null,
          "handle": "rimina",
          "shader_file": null,
          "shadertoy_url": null
        }
      ],
      "staffs": [
        {
          "handle": "LynnDrum",
          "job": "Dj Set"
        }
      ]
    }
  ],
  "staffs": []
}
