{
  "title": "In√©rcia 2020",
  "started": "2020-10-02",
  "date": "2 - 3 Oct 2020",
  "type": "Shader Royale",
  "vod": "https://www.youtube.com/watch?v=08Ll9OkMmOI",
  "software_used": null,
  "phases": [
    {
      "title": null,
      "entries": [
        {
          "id": "04",
          "rank": 1,
          "points": 141,
          "handle": "NuSan",
          "shader_file": "./shader_file_sources/shader_royale_1/grabber_inerciaroyale_nusan.glsl",
          "shadertoy_url": null,
          "preview_image" : "shader_royale_1/grabber_inerciaroyale_nusan.jpg"
        },
        {
          "id": "06",
          "rank": 2,
          "points": 140,
          "handle": "FMS_Cat",
          "shader_file": "./shader_file_sources/shader_royale_1/grabber_inerciaroyale_FMS_Cat.glsl",
          "shadertoy_url": null,
          "preview_image" : "shader_royale_1/grabber_inerciaroyale_FMS_Cat.jpg"
        },
        {
          "id": "01",
          "rank": 3,
          "points": 99,
          "handle": "wrighter",
          "shader_file": "./shader_file_sources/shader_royale_1/grabber_inerciaroyale_wrighter.glsl",
          "shadertoy_url": null,
          "preview_image" : "shader_royale_1/grabber_inerciaroyale_wrighter.jpg"
        },
        {
          "id": "08",
          "rank": 4,
          "points": 94,
          "handle": "evvvvil",
          "shader_file": "./shader_file_sources/shader_royale_1/grabber_inerciaroyale_evvvvil.glsl",
          "shadertoy_url": null,
          "preview_image" : "shader_royale_1/grabber_inerciaroyale_evvvvil.jpg"
        },
        {
          "id": "05",
          "rank": 5,
          "points": 73,
          "handle": "LechugaFeliz",
          "shader_file": "./shader_file_sources/shader_royale_1/grabber_inerciaroyale_LechugaFeliz.glsl",
          "shadertoy_url": null,
          "preview_image" : "shader_royale_1/grabber_inerciaroyale_LechugaFeliz.jpg"
        },
        {
          "id": "07",
          "rank": 6,
          "points": 71,
          "handle": "fizzer",
          "shader_file": "./shader_file_sources/shader_royale_1/grabber_inerciaroyale_fizzer.glsl",
          "shadertoy_url": null,
          "preview_image" : "shader_royale_1/grabber_inerciaroyale_fizzer.jpg"
        },
        {
          "id": "02",
          "rank": 7,
          "points": 70,
          "handle": "rimina",
          "shader_file": "./shader_file_sources/shader_royale_1/grabber_inerciaroyale_rimina.glsl",
          "shadertoy_url": null,
          "preview_image" : "shader_royale_1/grabber_inerciaroyale_rimina.jpg"
        },
        {
          "id": "03",
          "rank": 8,
          "points": 56,
          "handle": "provod",
          "shader_file": "./shader_file_sources/shader_royale_1/grabber_inerciaroyale_provod.glsl",
          "shadertoy_url": null,
          "preview_image" : "shader_royale_1/grabber_inerciaroyale_provod.jpg"
        },
        {
          "id": "09",
          "rank": 9,
          "points": 11,
          "handle": "blackle",
          "shader_file": null,
          "shadertoy_url": null
        }
      ],
      "staffs": [
        {
          "handle": "lug00ber",
          "job": "Dj Set"
        },
        {
          "handle": "ps",
          "job": "Commentators"
        }
      ]
    }
  ],
  "staffs": [
    {
      "handle": "ps",
      "job": "Organizers"
    },
    {
      "handle": "alien01",
      "job": "Organizers"
    }
  ]
}
